{
  "atribuciones": [
    {
      "autor": "Geoff Smart y Randy Street",
      "cifra": "uno de cada tres de los multimillonarios y consejeros delegados entrevistados para el libro dijo que no evaluar el encaje cultural fue una de las mayores razones de sus errores de contratacion",
      "fecha_corte": "2008",
      "fuente": "smart_who"
    }
  ],
  "condiciones_activacion": "Cuando vas a evaluar el encaje cultural de los candidatos, porque el libro dice que evaluar el encaje cultural empieza obviamente por evaluar la cultura de tu propia empresa. Tambien cuando tienes que decidir que competencias de cultura poner en las tarjetas de puntuacion y no sabes cuales son las tuyas.",
  "denominaciones": {
    "nombre_largo": "Evaluar la cultura de la empresa con la pregunta de los adjetivos",
    "otros_idiomas": [
      {
        "idioma": "ingles",
        "termino": "Cultural Competencies: Ensuring Organizational Fit"
      }
    ],
    "sigla": ""
  },
  "dominio": "contratacion",
  "entregable_esperado": "Los adjetivos que describen la cultura de tu empresa, escritos y a la vista, y traducidos en una serie de competencias que importan para todos los puestos.",
  "escala_minima": "Las competencias que salen de aqui van en la lista de competencias de todos los puestos, no solo en la del consejero delegado y el equipo directivo.",
  "fuentes": [
    {
      "clave": "smart_who",
      "fecha": "2026-09-10"
    }
  ],
  "id": "evaluar_cultura_empresa_adjetivos",
  "ids_alias": [],
  "nodos_previos": [],
  "nodos_siguientes": [],
  "pasos_accionables": [
    "Reune a tu equipo de direccion en una sala.",
    "Hazles esta pregunta simple: que adjetivos usariais para describir nuestra cultura.",
    "Anota sus respuestas en un rotafolio o en una pizarra, y espera: no tarda mucho en emerger una imagen.",
    "Traduce tu cultura y tus valores en una serie de competencias que importen para todos los puestos.",
    "Ponlas en la lista de competencias de todos los puestos, y no solo en la del consejero delegado y el equipo directivo.",
    "No tengas miedo de escribir lo que pueda parecer cegadoramente evidente, porque en el fragor de una crisis de contratacion las cosas mas claras a veces se pasan por alto."
  ],
  "resumen_teorico": "Las competencias trabajan en dos niveles: definen las habilidades y comportamientos que exige un puesto, y reflejan las demandas mas amplias de la cultura de la organizacion. Las de puesto son en general mas faciles de listar, pero el encaje cultural es igual de importante, y la gente que no encaja fracasa en el trabajo aunque sea perfectamente capaz en todo lo demas. Evaluar la cultura lleva tiempo y energia, pero suele dar hallazgos cuya utilidad va mas alla de la contratacion. El ejercicio que el libro describe lo hicieron con un cliente nuevo: la sala se lleno enseguida de palabras como analitica, rapida e informal, y aunque fue rapido y tosco fue honesto, y esa honestidad les permitio enfocar la contratacion a corto plazo en gente que pudiera con todo eso, y a largo plazo pensar hacia donde queria ir la empresa culturalmente. El otro lado de la moneda, que el capitulo tambien pone: evaluar la cultura a veces significa apartar a quien no encaja, y el mejor vendedor del mundo es la contratacion equivocada si valoras el respeto y el es abiertamente irrespetuoso. Los casos nombrados son el de George Hamilton, del Institute for Sustainable Communities, cuyo fichaje estrella resulto insoportable en una cultura colaborativa y no competitiva, y el de Aaron Kennedy, fundador de Noodles & Company, que contrato a un consejero delegado de una empresa grande cuyo estilo choco con los valores de la casa y termino apartandolo. El contraejemplo positivo es Centerbridge Partners, que puso trato respetuoso y confiabilidad como competencias clave de todos los puestos y descarto a un inversor muy capaz por su forma de tratar a la gente.",
  "titulo": "Evaluar la cultura de la empresa con la pregunta de los adjetivos"
}
